{
  "schema_version": "1.0.0",
  "generated_by": "cowork:eod-review@2.0.0",
  "generated_at": "2026-06-08T18:00:00Z",
  "cadence": "eod-review",
  "engagement_id": "test-personal",
  "frontmatter": {
    "type": "cowork-eod-review",
    "engagement_id": "test-personal",
    "day": "2026-06-08",
    "title": "EOD Review Test",
    "summary": "test",
    "created_at": "2026-06-08T18:00:00Z"
  },
  "surfaced_kinds": ["calendar"],
  "surfaced_items": [],
  "render_aspects_applied": [],
  "memory_used": { "yesterday_present": false, "drift_warning_present": false, "echoes_count": 0 },
  "plan_dispatch": { "mode": "prefs", "kinds_dispatched": 1, "warnings_emitted": 0 }
}
